Id,CouncilPeriod,ShortTitle,Introducer,LegislationNumber,LawNumber,ActNumber,IntroductionDate,Modified,CommitteeReferral,CommitteeReferralComments,Deemed,DeemedOn,LegislationStatus,Category,Subcategory,DocumentUrl
37937,22,Statewide Health Coordinating Council Goulda Downer Confirmation Resolution of 2017,Chairman Mendelson,PR22-0269,,,2017-04-13,2017-06-28,Committee on Health,,Approved,2017-06-17,Deemed Approved,Resolution,Proposed Resolution,http://lims.dccouncil.us/Download/37937/PR22-0269-Introduction.pdf
37936,22,Statewide Health Coordinating Council Barbara Ormond Confirmation Resolution of 2017,Chairman Mendelson,PR22-0268,,,2017-04-13,2017-06-28,Committee on Health,,Approved,2017-06-17,Deemed Approved,Resolution,Proposed Resolution,http://lims.dccouncil.us/Download/37936/PR22-0268-Introduction.pdf
37935,22,Board of Nursing Layo George Confirmation Resolution of 2017,Chairman Mendelson,PR22-0267,,,2017-04-13,2017-06-28,Committee on Health,,Approved,2017-06-17,Deemed Approved,Resolution,Proposed Resolution,http://lims.dccouncil.us/Download/37935/PR22-0267-Introduction.pdf
37934,22,Board of Accountancy Angela Avant Confirmation Resolution of 2017,Chairman Mendelson,PR22-0266,,,2017-04-13,2017-06-28,Committee on Business and Economic Development,,Approved,2017-06-17,Deemed Approved,Resolution,Proposed Resolution,http://lims.dccouncil.us/Download/37934/PR22-0266-Introduction.pdf
37933,22,"Paul Public Charter School, Inc. Revenue Bonds Project Approval Resolution of 2017",Chairman Mendelson,PR22-0265,,R22-0128,2017-04-12,2017-06-28,Committee on Finance and Revenue,,,,Approved,Resolution,Proposed Resolution,http://lims.dccouncil.us/Download/37933/PR22-0265-Introduction.pdf
37932,22,Vital Records Modernization Act of 2017,Chairman Mendelson,B22-0250,,,2017-04-12,2017-08-07,Committee on Health,,,,Under Council Review,Bill,Permanent Bill,http://lims.dccouncil.us/Download/37932/B22-0250-Introduction.pdf
37931,22,Modifications to Human Care Agreement No. DCRL-2013-H-0039J with Latin American Youth Center Approval and Payment Authorization Emergency Act of 2017,Chairman Mendelson,B22-0249,,A22-0063,2017-04-12,2017-05-30,Retained by the Council,,,,Enacted,Bill,Emergency Bill,http://lims.dccouncil.us/Download/37931/B22-0249-Introduction.pdf
37930,22,Modifications to Human Care Agreement No. DCRL-2013-H-0039J with Latin American Youth Center Approval and Payment Authorization Emergency Declaration Resolution of 2017,Chairman Mendelson,PR22-0264,,R22-0102,2017-04-12,2017-05-15,Retained by the Council,,,,Approved,Resolution,Emergency Declaration Resolution,http://lims.dccouncil.us/Download/37930/PR22-0264-Introduction.pdf
37929,22,"Change Order Nos. 001 through 005 to Contract DCAM-16-CS-0032 with MCN Build, Inc. Approval and Emergency Act of 2017",Chairman Mendelson,B22-0248,,A22-0062,2017-04-12,2017-05-30,Retained by the Council,,,,Enacted,Bill,Emergency Bill,http://lims.dccouncil.us/Download/37929/B22-0248-Introduction.pdf
37928,22,"Change Order Nos. 001 through 005 to Contract DCAM-16-CS-0032 with MCN Build, Inc. Approval and Emergency Declaration Resolution of 2017",Chairman Mendelson,PR22-0263,,R22-0108,2017-04-12,2017-05-30,Retained by the Council,,,,Approved,Resolution,Emergency Declaration Resolution,http://lims.dccouncil.us/Download/37928/PR22-0263-Introduction.pdf
37927,22,"Modifications to Human Care Agreement No. DCRL-2013-H-0039B with Boys Town Washington DC, Inc. Approval and Payment Authorization Emergency Act  of 2017",Chairman Mendelson,B22-0247,,A22-0060,2017-04-12,2017-05-30,Retained by the Council,,,,Enacted,Bill,Emergency Bill,http://lims.dccouncil.us/Download/37927/B22-0247-Introduction.pdf
37926,22,"Modifications to Human Care Agreement No. DCRL-2013-H-0039B with Boys Town Washington DC, Inc. Approval and Payment  Authorization Emergency Declaration Resolution of 2017",Chairman Mendelson,PR22-0262,,R22-0101,2017-04-12,2017-05-15,Retained by the Council,,,,Approved,Resolution,Emergency Declaration Resolution,
37923,22,Notification of a Proposed Revenue Bond Issuance by the District of Columbia Housing Finance Agency,Chairman Mendelson,HFA22-0005,,,2017-04-12,2017-06-30,Retained by the Council,,Approved,2017-06-15,Deemed Approved,Housing Finance Agency,Housing Finance Agency,http://lims.dccouncil.us/Download/37923/HFA22-0005-Introduction.pdf
37916,22,Sense of the Council Reaffirming the District's Commitment to Climate Change Action Resolution of 2017,"Councilmembers Cheh, Bonds, Silverman, Gray, R. White, Grosso, Todd, Allen, Evans, and Chairman Mendelson",PR22-0261,,,2017-04-04,2017-07-10,Committee on Transportation and the Environment,,,,Under Council Review,Resolution,Proposed Resolution,
37915,22,"Request to reprogram $1,373,100 of Local Funds Budget Authority within the Department of Corrections",Chairman Mendelson,REPROG22-0033,,,2017-04-12,2017-05-04,Retained by the Council,,Approved,2017-04-27,Deemed Approved,Reprogramming,Reprogramming,http://lims.dccouncil.us/Download/37915/REPROG22-0033-Introduction.pdf
37914,22,"Request to reprogram $500,000 of Special Purpose Revenue Funds Budget Authority from the Department of Energy and Environment to the Pay-As-You-Go Capital Fund",Chairman Mendelson,REPROG22-0032,,,2017-04-12,2017-05-04,Retained by the Council,,Approved,2017-04-27,Deemed Approved,Reprogramming,Reprogramming,http://lims.dccouncil.us/Download/37914/REPROG22-0032-Introduction.pdf
37903,22,Local Rent Supplement Program Contract No. 2013-LRSP-10A Approval Resolution of 2017,Chairman Mendelson,PR22-0260,,R22-0100,2017-04-10,2017-05-15,Retained by the Council,,,,Approved,Resolution,Proposed Resolution,http://lims.dccouncil.us/Download/37903/PR22-0260-Introduction.pdf
37902,22,Board of Veterinary Medicine Leanne Lipton Confirmation Resolution of 2017,Chairman Mendelson,PR22-0259,,,2017-04-10,2017-06-28,Committee on Health,,Approved,2017-06-17,Deemed Approved,Resolution,Proposed Resolution,http://lims.dccouncil.us/Download/37902/PR22-0259-Introduction.pdf
37900,22,Real Property Tax Appeals Commission Ms. Wendy Gadson Confirmation Resolution of 2017,Chairman Mendelson,PR22-0257,,R22-0127,2017-04-10,2017-06-26,Committee on Finance and Revenue,,Disapproved,2017-10-02,Approved,Resolution,Proposed Resolution,http://lims.dccouncil.us/Download/37900/PR22-0257-Introduction.pdf
37899,22,Real Property Tax Appeals Commission Mr. Frank Sanders Confirmation Resolution of 2017,Chairman Mendelson,PR22-0256,,R22-0126,2017-04-10,2017-06-26,Committee on Finance and Revenue,,Disapproved,2017-10-02,Approved,Resolution,Proposed Resolution,http://lims.dccouncil.us/Download/37899/PR22-0256-Introduction.pdf
37898,22,Real Property Tax Appeals Commission Mr. Alvin Lee Jackson Confirmation Resolution of 2017,Chairman Mendelson,PR22-0255,,R22-0125,2017-04-10,2017-06-26,Committee on Finance and Revenue,,Disapproved,2017-10-02,Approved,Resolution,Proposed Resolution,http://lims.dccouncil.us/Download/37898/PR22-0255-Introduction.pdf
37897,22,Chief Tenant Advocate of the Office of the Tenant Advocate Johanna Shreve Confirmation Resolution of 2017,Chairman Mendelson,PR22-0254,,R22-0154,2017-04-10,2017-07-24,Committee on Housing and Neighborhood Revitalization ,,,,Approved,Resolution,Proposed Resolution,http://lims.dccouncil.us/Download/37897/PR22-0254-Introduction.pdf
37896,22,Board of Long-Term Care Administration Toya Carmichael Confirmation Resolution of 2017,Chairman Mendelson,PR22-0253,,,2017-04-10,2017-06-28,Committee on Health,,Approved,2017-06-17,Deemed Approved,Resolution,Proposed Resolution,http://lims.dccouncil.us/Download/37896/PR22-0253-Introduction.pdf
37895,22,Board of Dietetics and Nutrition Kimberly Thompson Confirmation Resolution of 2017,Chairman Mendelson,PR22-0252,,,2017-04-10,2017-06-28,Committee on Health,,Approved,2017-06-17,Deemed Approved,Resolution,Proposed Resolution,http://lims.dccouncil.us/Download/37895/PR22-0252-Introduction.pdf
37894,22,Board of Dietetics and Nutrition Annina Burns Confirmation Resolution of 2017,Chairman Mendelson,PR22-0251,,,2017-04-11,2017-06-28,Committee on Health,,Approved,2017-06-17,Deemed Approved,Resolution,Proposed Resolution,http://lims.dccouncil.us/Download/37894/PR22-0251-Introduction.pdf
37893,22,Board of Industrial Trades Terrence Hughes Confirmation Resolution of 2017,Chairman Mendelson,PR22-0250,,,2017-04-10,2017-06-28,Committee on Business and Economic Development,,Approved,2017-06-17,Deemed Approved,Resolution,Proposed Resolution,http://lims.dccouncil.us/Download/37893/PR22-0250-Introduction.pdf
37892,22,Board of Industrial Trades Richard Jackson Confirmation Resolution of 2017,Chairman Mendelson,PR22-0249,,,2017-04-10,2017-06-28,Committee on Business and Economic Development,,Approved,2017-06-17,Deemed Approved,Resolution,Proposed Resolution,http://lims.dccouncil.us/Download/37892/PR22-0249-Introduction.pdf
37891,22,Board of Industrial Trades Garth Grannum Confirmation Resolution of 2017,Chairman Mendelson,PR22-0248,,,2017-04-10,2017-06-28,Committee on Business and Economic Development,,Approved,2017-06-17,Deemed Approved,Resolution,Proposed Resolution,http://lims.dccouncil.us/Download/37891/PR22-0248-Introduction.pdf
37890,22,Board of Industrial Trades Constantin Rodousakis Confirmation Resolution of 2017,Chairman Mendelson,PR22-0247,,,2017-04-10,2017-06-28,Committee on Business and Economic Development,,Approved,2017-06-17,Deemed Approved,Resolution,Proposed Resolution,http://lims.dccouncil.us/Download/37890/PR22-0247-Introduction.pdf
37888,22,"Proposed Multi-Year contract between the District of Columbia Housing Authority (""DCHA"") and Jubilee-Maycroft Apartments, LP (the ""Owner"") ",Chairman Mendelson,CA22-0069,,,2017-04-10,2017-05-04,Retained by the Council,,Disapproved,2017-05-25,Approved,Contract,Contract,http://lims.dccouncil.us/Download/37888/CA22-0069-Introduction.pdf
37887,22,Frank W. Ballou Senior High School Class of 2017 College Application Recognition Resolution of 2017,Councilmember T. White,CER22-0082,,ACR22-0082,2017-04-03,2017-07-20,Retained by the Council,,,,Approved,Resolution,Ceremonial Resolution,http://lims.dccouncil.us/Download/37887/CER22-0082-Introduction.pdf
37886,22,"49th Anniversary of the Assassination of Dr. Martin Luther King, Jr. Ceremonial Resolution of 2017","Chairman Mendelson and Councilmembers Nadeau, Evans, Cheh, Todd, McDuffie, Allen, Gray, T. White, Silverman, Bonds, Grosso, and R. White",CER22-0081,,ACR22-0081,2017-04-03,2017-07-20,Retained by the Council,,,,Approved,Resolution,Ceremonial Resolution,http://lims.dccouncil.us/Download/37886/CER22-0081-Introduction.pdf
37885,22,Robin Kelly Recognition Resolution of 2017,Councilmember McDuffie,CER22-0080,,ACR22-0080,2017-04-03,2017-07-20,Retained by the Council,,,,Approved,Resolution,Ceremonial Resolution,http://lims.dccouncil.us/Download/37885/CER22-0080-Introduction.pdf
37884,22,Wade Henderson Recognition Resolution of 2017,Councilmember McDuffie,CER22-0079,,ACR22-0079,2017-04-03,2017-07-20,Retained by the Council,,,,Approved,Resolution,Ceremonial Resolution,http://lims.dccouncil.us/Download/37884/CER22-0079-Introduction.pdf
37883,22,Safe Digging Month Recognition Resolution of 2017,Councilmember McDuffie,CER22-0078,,ACR22-0078,2017-04-03,2017-07-20,Retained by the Council,,,,Approved,Resolution,Ceremonial Resolution,http://lims.dccouncil.us/Download/37883/CER22-0078-Introduction.pdf
37882,22,"Masjid Muhammad, The Nation's Mosque 80th Anniversary Celebration Resolution of 2017",Councilmember McDuffie,CER22-0077,,ACR22-0077,2017-04-03,2017-07-20,Retained by the Council,,,,Approved,Resolution,Ceremonial Resolution,http://lims.dccouncil.us/Download/37882/CER22-0077-Introduction.pdf
37881,22,Mary Louise Bridgewater Barnes Recognition Resolution of 2017,Councilmember McDuffie,CER22-0076,,ACR22-0076,2017-04-03,2017-07-20,Retained by the Council,,,,Approved,Resolution,Ceremonial Resolution,http://lims.dccouncil.us/Download/37881/CER22-0076-Introduction.pdf
37880,22,Jeff Ballou Recognition Resolution of 2017,Councilmember McDuffie,CER22-0075,,ACR22-0075,2017-04-03,2017-07-19,Retained by the Council,,,,Approved,Resolution,Ceremonial Resolution,http://lims.dccouncil.us/Download/37880/CER22-0075-Introduction.pdf
37879,22,Ridge Road Titans Junior Pee Wee Champion Football Team Recognition Resolution of 2017,Councilmember Gray,CER22-0074,,ACR22-0074,2017-04-03,2017-07-19,Retained by the Council,,,,Approved,Resolution,Ceremonial Resolution,http://lims.dccouncil.us/Download/37879/CER22-0074-Introduction.pdf
37878,22,National Charter Schools Week Recognition Resolution of 2017,Councilmember Grosso,CER22-0073,,ACR22-0073,2017-03-31,2017-07-19,Retained by the Council,,,,Approved,Resolution,Ceremonial Resolution,http://lims.dccouncil.us/Download/37878/CER22-0073-Introduction.pdf
37877,22,"African-American Music Association, Inc. 34th Annual Marvin Gaye Day Recognition Resolution of 2017",Councilmember Gray,CER22-0072,,ACR22-0072,2017-03-30,2017-07-19,Retained by the Council,,,,Approved,Resolution,Ceremonial Resolution,http://lims.dccouncil.us/Download/37877/CER22-0072-Introduction.pdf
37876,22,Father Michael J. Kelley Recognition Resolution of 2017,Councilmembers R. White and McDuffie,CER22-0071,,ACR22-0071,2017-03-30,2017-07-19,Retained by the Council,,,,Approved,Resolution,Ceremonial Resolution,http://lims.dccouncil.us/Download/37876/CER22-0071-Introduction.pdf
37875,22,Sam Gilliam Ceremonial Recognition Resolution of 2017,Councilmember Todd,CER22-0070,,ACR22-0070,2017-03-29,2017-07-19,Retained by the Council,,,,Approved,Resolution,Ceremonial Resolution,http://lims.dccouncil.us/Download/37875/CER22-0070-Introduction.pdf
37874,22,Dr. Johnnetta Betsch Cole Recognition Resolution of 2017,Councilmember Gray,CER22-0069,,ACR22-0069,2017-03-29,2017-07-19,Retained by the Council,,,,Approved,Resolution,Ceremonial Resolution,http://lims.dccouncil.us/Download/37874/CER22-0069-Introduction.pdf
37873,22,Dr. Elizabeth (Bettye) Bouey Yates Day Recognition Resolution of 2017,Councilmember Allen,CER22-0068,,ACR22-0068,2017-03-29,2017-07-19,Retained by the Council,,,,Approved,Resolution,Ceremonial Resolution,http://lims.dccouncil.us/Download/37873/CER22-0068-Introduction.pdf
37872,22,Jacque Patterson Ceremonial Recognition Resolution of 2017,Councilmember Todd,CER22-0067,,ACR22-0067,2017-03-28,2017-07-19,Retained by the Council,,,,Approved,Resolution,Ceremonial Resolution,http://lims.dccouncil.us/Download/37872/CER22-0067-Introduction.pdf
37871,22,Chagas Disease Awareness Day Recognition Resolution of 2017,Councilmember Todd,CER22-0066,,ACR22-0066,2017-03-28,2017-07-19,Retained by the Council,,,,Approved,Resolution,Ceremonial Resolution,http://lims.dccouncil.us/Download/37871/CER22-0066-Introduction.pdf
37870,22,District of Columbia Emancipation Day – 155th Anniversary Ceremonial Recognition Resolution of 2017,Councilmember Todd,CER22-0065,,ACR22-0065,2017-03-28,2017-07-19,Retained by the Council,,,,Approved,Resolution,Ceremonial Resolution,http://lims.dccouncil.us/Download/37870/CER22-0065-Introduction.pdf
37869,22,National World Health Day Recognition Resolution of 2017,Councilmember Todd,CER22-0064,,ACR22-0064,2017-03-28,2017-07-19,Retained by the Council,,,,Approved,Resolution,Ceremonial Resolution,http://lims.dccouncil.us/Download/37869/CER22-0064-Introduction.pdf
37868,22,Financial Literacy Month Recognition Resolution of 2017,Councilmember Todd,CER22-0063,,ACR22-0063,2017-03-28,2017-07-19,Retained by the Council,,,,Approved,Resolution,Ceremonial Resolution,http://lims.dccouncil.us/Download/37868/CER22-0063-Introduction.pdf
37867,22,Emory Beacon of Light 20th Anniversary Ceremonial Recognition Resolution of 2017,Councilmember Todd,CER22-0062,,ACR22-0062,2017-03-28,2017-07-19,Retained by the Council,,,,Approved,Resolution,Ceremonial Resolution,http://lims.dccouncil.us/Download/37867/CER22-0062-Introduction.pdf
37866,22,National Autism Awareness Month Recognition Resolution of 2017,Councilmember Todd,CER22-0061,,ACR22-0061,2017-03-28,2017-07-19,Retained by the Council,,,,Approved,Resolution,Ceremonial Resolution,http://lims.dccouncil.us/Download/37866/CER22-0061-Introduction.pdf
37865,22,Capitol Hill Arts Workshop 45th Anniversary Recognition Resolution of 2017,Councilmember Allen,CER22-0060,,ACR22-0060,2017-03-23,2017-07-19,Retained by the Council,,,,Approved,Resolution,Ceremonial Resolution,http://lims.dccouncil.us/Download/37865/CER22-0060-Introduction.pdf
37864,22,Developmental Disabilities Awareness Month Recognition Resolution of 2017,"Councilmembers Nadeau, Evans, Silverman, Todd, R. White, Allen, Cheh, and Chairman Mendelson",CER22-0059,,ACR22-0059,2017-03-21,2017-07-19,Retained by the Council,,,,Approved,Resolution,Ceremonial Resolution,http://lims.dccouncil.us/Download/37864/CER22-0059-Introduction.pdf
37863,22,St. Mary's Episcopal Church One Hundred and Fiftieth Anniversary Celebration Recognition Resolution of 2017,Councilmembers Evans and Todd,CER22-0058,,ACR22-0058,2017-03-20,2017-07-19,Retained by the Council,,,,Approved,Resolution,Ceremonial Resolution,http://lims.dccouncil.us/Download/37863/CER22-0058-Introduction.pdf
37862,22,Dianne Sucora Williams Recognition Resolution of 2017,Councilmember Gray,CER22-0057,,ACR22-0057,2017-03-09,2017-07-19,Retained by the Council,,,,Approved,Resolution,Ceremonial Resolution,
37861,22,Commission on Health Equity M. Jermane Bond Appointment Resolution of 2017,Chairman Mendelson,PR22-0246,,R22-0123,2017-04-07,2017-07-10,Committee of the Whole,,,,Approved,Resolution,Proposed Resolution,http://lims.dccouncil.us/Download/37861/PR22-0246-Introduction.pdf
37860,22,Commission on Health Equity Christopher Selhorst Appointment Resolution of 2017,Chairman Mendelson,PR22-0245,,R22-0122,2017-04-07,2017-07-10,Committee of the Whole,,,,Approved,Resolution,Proposed Resolution,http://lims.dccouncil.us/Download/37860/PR22-0245-Introduction.pdf
37859,22,Commission on Health Equity Alicia Wilson Appointment Resolution of 2017,Chairman Mendelson,PR22-0244,,R22-0121,2017-04-07,2017-07-10,Committee of the Whole,,,,Approved,Resolution,Proposed Resolution,http://lims.dccouncil.us/Download/37859/PR22-0244-Introduction.pdf
37858,22,Commission on Health Equity R. Daniel Okonkwo Appointment Resolution of 2017,Chairman Mendelson,PR22-0243,,R22-0146,2017-04-07,2017-07-10,Committee of the Whole,,,,Approved,Resolution,Proposed Resolution,http://lims.dccouncil.us/Download/37858/PR22-0243-Introduction.pdf
37857,22,"Modifications Nos. 001 and 002 to Contract No. DCAM-15-CS-0097L with JDC Construction Company, LLC Approval and Payment Authorization Emergency Act of 2017",Chairman Mendelson,B22-0246,,A22-0059,2017-04-07,2017-05-30,Retained by the Council,,,,Enacted,Bill,Emergency Bill,http://lims.dccouncil.us/Download/37857/B22-0246-Introduction.pdf
37856,22,"Modifications Nos. 001 and 002 to Contract No. DCAM-15-CS-0097L with JDC Construction Company, LLC Approval and Payment Authorization Emergency Declaration Resolution of 2017",Chairman Mendelson,PR22-0242,,R22-0106,2017-04-07,2017-05-15,Retained by the Council,,,,Approved,Resolution,Emergency Declaration Resolution,http://lims.dccouncil.us/Download/37856/PR22-0242-Introduction.pdf
37855,22,"Modification Nos. 001 and 002 to Contract No. DCAM-15-CS-0097B with The Temple Group, Inc. Approval Emergency Act of 2017",Chairman Mendelson,B22-0245,,A22-0058,2017-04-05,2017-05-30,Retained by the Council,,,,Enacted,Bill,Emergency Bill,http://lims.dccouncil.us/Download/37855/B22-0245-Introduction.pdf
37854,22,"Modification Nos. 001 and 002 to Contract No. DCAM-15-CS-0097B with The Temple Group, Inc. Approval Emergency Declaration Resolution of 2017",Chairman Mendelson,PR22-0241,,R22-0107,2017-04-05,2017-05-15,Retained by the Council,,,,Approved,Resolution,Emergency Declaration Resolution,http://lims.dccouncil.us/Download/37854/PR22-0241-Introduction.pdf
37853,22,Fiscal Year 2018 Budget Support Act of 2017,Chairman Mendelson,B22-0244,,A22-0130,2017-04-04,2017-08-14,Committee of the Whole,,,,Enacted,Bill,Permanent Bill,http://lims.dccouncil.us/Download/37853/B22-0244-Introduction.pdf
37852,22,"Proposed Sole Source contract with Universal Protection Services, LP dba Allied Universal Security formerly Allied Barton ",Chairman Mendelson,CA22-0068,,,2017-04-07,2017-07-18,Retained by the Council,,Approved,2017-04-20,Deemed Approved,Contract,Contract,http://lims.dccouncil.us/Download/37852/CA22-0068-Introduction.pdf
37847,22,Modification Nos. 001 and 002 to Contract No. DCAM-15-CS-0097E with Jacobs Project Management Co. Approval Emergency Act of 2017,Chairman Mendelson,B22-0243,,A22-0057,2017-04-04,2017-05-30,Retained by the Council,,,,Enacted,Bill,Emergency Bill,http://lims.dccouncil.us/Download/37847/B22-0243-Introduction.pdf
37846,22,Modification Nos. 001 and 002 to Contract No. DCAM-15-CS-0097E with Jacobs Project Management Co. Approval Emergency Declaration Resolution of 2017,Chairman Mendelson,PR22-0240,,R22-0105,2017-04-04,2017-05-15,Retained by the Council,,,,Approved,Resolution,Emergency Declaration Resolution,http://lims.dccouncil.us/Download/37846/PR22-0240-Introduction.pdf
37845,22,Fiscal Year 2018 Local Budget Act of 2017,Chairman Mendelson,B22-0242,,A22-0099,2017-04-04,2017-07-18,Committee of the Whole,,,,Under Congressional Review,Bill,Permanent Bill,http://lims.dccouncil.us/Download/37845/B22-0242-Introduction.pdf
37844,22,Fiscal Year 2018 Federal Portion Budget Request Act of 2017,Chairman Mendelson,B22-0241,,A22-0098,2017-04-04,2017-07-17,Committee of the Whole,,,,Enacted,Bill,Permanent Bill,http://lims.dccouncil.us/Download/37844/B22-0241-Introduction.pdf
37843,22,Fiscal Year 2017 Revised Budget Request Temporary Adjustment Act of 2017,Chairman Mendelson,B22-0240,,A22-0097,2017-04-04,2017-07-17,Retained by the Council,,,,Under Congressional Review,Bill,Temporary Bill,http://lims.dccouncil.us/Download/37843/B22-0240-Introduction.pdf
37842,22,Fiscal Year 2017 Revised Budget Request Emergency Adjustment Act of 2017 ,Chairman Mendelson,B22-0239,,A22-0096,2017-04-04,2017-07-17,Retained by the Council,,,,Enacted,Bill,Emergency Bill,http://lims.dccouncil.us/Download/37842/B22-0239-Introduction.pdf
37841,22,Fiscal Year 2017 Revised Budget Request Adjustment Emergency Declaration Resolution of 2017,Chairman Mendelson,PR22-0239,,R22-0145,2017-04-04,2017-07-31,Retained by the Council,,,,Approved,Resolution,Emergency Declaration Resolution,http://lims.dccouncil.us/Download/37841/PR22-0239-Introduction.pdf
37840,22,Apprenticeship Council Ioannis Xanthos Confirmation Resolution of 2017,Chairman Mendelson,PR22-0238,,,2017-04-04,2017-06-30,Committee on Labor and Workforce Development,,Approved,2017-06-17,Deemed Approved,Resolution,Proposed Resolution,http://lims.dccouncil.us/Download/37840/PR22-0238-Introduction.pdf
37839,22,Apprenticeship Council Quenton Horton Confirmation Resolution of 2017,Chairman Mendelson,PR22-0237,,,2017-04-04,2017-06-28,Committee on Labor and Workforce Development,,Approved,2017-06-17,Deemed Approved,Resolution,Proposed Resolution,http://lims.dccouncil.us/Download/37839/PR22-0237-Introduction.pdf
37838,22,Board of Occupational Therapy Anthony Roberson Confirmation Resolution of 2017,Chairman Mendelson,PR22-0236,,,2017-04-04,2017-06-28,Committee on Health,,Approved,2017-06-17,Deemed Approved,Resolution,Proposed Resolution,http://lims.dccouncil.us/Download/37838/PR22-0236-Introduction.pdf
37827,22,"Proposed contract with Rite of Passage, Inc. ",Chairman Mendelson,CA22-0058,,,2017-04-05,2017-05-01,Retained by the Council,,Approved,2017-04-16,Deemed Approved,Contract,Contract,
37826,22,Parking Ticket Waiver Act of 2017,Chairman Mendelson and Councilmember McDuffie,B22-0237,,,2017-04-04,2017-05-10,Committee on Transportation and the Environment,,,,Under Council Review,Bill,Permanent Bill,http://lims.dccouncil.us/Download/37826/B22-0237-Introduction.pdf
37822,22,DC Main Streets Public Space Permit Fee Waiver Amendment Act of 2017,"Councilmembers McDuffie, Gray, Evans, Bonds, and Allen",B22-0236,,,2017-04-04,2017-06-07,Committee on Business and Economic Development,,,,Under Council Review,Bill,Permanent Bill,http://lims.dccouncil.us/Download/37822/B22-0236-Introduction.pdf
37821,22,Managing Outdoor Work for Seniors Amendment Act of 2017,"Councilmembers McDuffie, T. White, R. White, Bonds, Nadeau, and Silverman",B22-0235,,,2017-04-04,2017-08-07,Committee on Housing and Neighborhood Revitalization ,,,,Under Council Review,Bill,Permanent Bill,http://lims.dccouncil.us/Download/37821/B22-0235-Introduction.pdf
37819,22,Telehealth Medicaid Expansion Act of 2017,"Councilmembers Gray, Nadeau, Cheh, Grosso, and McDuffie",B22-0233,,,2017-04-04,2017-08-07,Committee on Health,,,,Under Council Review,Bill,Permanent Bill,http://lims.dccouncil.us/Download/37819/B22-0233-Introduction.pdf
37818,22,School Health Innovations Grant Act of 2017,"Councilmembers Gray, Nadeau, R. White, Grosso, Cheh, and McDuffie",B22-0232,,,2017-04-04,2017-06-05,Committee on Health,,,,Under Council Review,Bill,Permanent Bill,http://lims.dccouncil.us/Download/37818/B22-0232-Introduction.pdf
37817,22,Department of Health Care Finance D.C. HealthCare Alliance Amendment Act of 2017,Councilmember Gray,B22-0231,,,2017-04-04,2017-06-05,Committee on Health,,,,Under Council Review,Bill,Permanent Bill,http://lims.dccouncil.us/Download/37817/B22-0231-Introduction.pdf
37814,22,Safe Disposal of Pharmaceuticals Amendment Act of 2017,"Councilmembers Nadeau, Grosso, Evans, Bonds, McDuffie, Silverman, and Chairman Mendelson",B22-0228,,,2017-04-04,2017-08-07,Committee on Health,,,,Under Council Review,Bill,Permanent Bill,http://lims.dccouncil.us/Download/37814/B22-0228-Introduction.pdf
37813,22,TANF Child Benefit Protection Amendment Act of 2017,"Councilmembers Nadeau, Silverman, Todd, R. White, McDuffie, and T. White",B22-0227,,,2017-04-04,2017-06-05,Committee on Human Services,,,,Under Council Review,Bill,Permanent Bill,http://lims.dccouncil.us/Download/37813/B22-0227-Introduction.pdf
